{
  "schema": "intyy.suite/1.0",
  "capability": "kvfcu/open_share_subaccount@1",
  "revision": 1,
  "reason": "First suite. Three input classes (valid, missing member, member at the sub-account limit), the standard fault matrix on valid, and the supervisor case. The reply_lost profile in the matrix covers a lost commit reply: the artifact carries a cited reconciliation waiver (no read-only check can count the sub-account rows), so it must end escalated, reconciliation_waived at click_confirm, with commit uncertain. The at_limit member is refused when the form opens, before Confirm, so its commit is not_sent (M05 demo, 2026-10-01).",
  "classes": [
    {
      "id": "valid",
      "inputs": {
        "member_id": "@members.valid",
        "deposit": "137.00"
      },
      "expect": {
        "status": "success",
        "commit": "confirmed"
      }
    },
    {
      "id": "missing",
      "inputs": {
        "member_id": "@members.missing",
        "deposit": "137.00"
      },
      "expect": {
        "status": "business_outcome",
        "outcome": "member_not_found",
        "commit": "not_sent"
      }
    },
    {
      "id": "at_limit",
      "inputs": {
        "member_id": "@members.at_limit",
        "deposit": "137.00"
      },
      "expect": {
        "status": "business_outcome",
        "outcome": "limit_exceeded",
        "commit": "not_sent"
      }
    }
  ],
  "matrix": {
    "class": "valid",
    "profiles": "standard"
  },
  "stability": {
    "class": "valid",
    "levels": [
      0.05,
      0.15,
      0.3
    ],
    "seeds": 5,
    "twins": true
  },
  "drills": {
    "count": 0
  },
  "extra": [
    {
      "id": "supervisor_needed",
      "class": "valid",
      "faults": [
        {
          "kind": "supervisor_required",
          "at": "@step:click_submit"
        }
      ],
      "expect": {
        "status": "escalated",
        "kind": "takeover",
        "reason": "needs_human_handler",
        "step": "click_submit"
      }
    }
  ],
  "setup": [],
  "provenance": {
    "runs": [],
    "decisions": [],
    "sealed": null
  },
  "approved": {
    "by": "op_031",
    "at": "2026-10-01T22:56:42.470Z"
  }
}
