{
  "schema": "intyy.suite/1.0",
  "capability": "kvfcu/count_member_subaccounts@1",
  "revision": 1,
  "reason": "First suite. A read-only capability with one input and one outcome, so one class covers it. No missing-member class: no negative discovery spec exists for it yet.",
  "classes": [
    {
      "id": "valid",
      "inputs": { "member_id": "@members.valid" },
      "expect": { "status": "success" }
    }
  ],
  "matrix": { "class": "valid", "profiles": "standard" },
  "stability": { "class": "valid", "levels": [0.05, 0.15, 0.3], "seeds": 5, "twins": true },
  "drills": { "count": 0 },
  "extra": [],
  "setup": [],
  "provenance": { "runs": [], "decisions": [], "sealed": null }
}
