{
  "schema": "intyy.suite/1.0",
  "capability": "kvfcu/sign_in@1",
  "revision": 1,
  "reason": "First suite. Sign in takes no inputs and has one outcome, so one class covers it.",
  "classes": [
    {
      "id": "signed_in",
      "inputs": {},
      "expect": {
        "status": "success"
      }
    }
  ],
  "matrix": {
    "class": "signed_in",
    "profiles": "standard"
  },
  "stability": {
    "class": "signed_in",
    "levels": [
      0.05,
      0.15,
      0.3
    ],
    "seeds": 5,
    "twins": true
  },
  "drills": {
    "count": 0
  },
  "extra": [],
  "setup": [],
  "provenance": {
    "runs": [],
    "decisions": [],
    "sealed": null
  },
  "approved": {
    "by": "op_031",
    "at": "2026-10-02T16:48:59.435Z"
  }
}
